Q7181,Congenital shortening of upper limb,http://purl.obolibrary.org/obo/HP_0100554,Hemihypertrophy of upper limb,2,http://purl.obolibrary.org/obo/HP_0006986,Spasticity of upper limb,2
Q71811,Congenital shortening of right upper limb,http://purl.obolibrary.org/obo/HP_0002817,Abnormality of the upper limb,3,http://purl.obolibrary.org/obo/HP_0002817,Abnormality of the upper limb,3
Q71812,Congenital shortening of left upper limb,http://purl.obolibrary.org/obo/HP_0002817,Abnormality of the upper limb,3,http://purl.obolibrary.org/obo/HP_0002817,Abnormality of the upper limb,3
Q71813,"Congenital shortening of upper limb, bilateral",http://purl.obolibrary.org/obo/MONDO_0017479,"amelia of upper limb, bilateral",2,http://purl.obolibrary.org/obo/HP_0000177,Abnormality of upper lip,4
Q71819,Congenital shortening of unspecified upper limb,http://purl.obolibrary.org/obo/HP_0002817,Abnormality of the upper limb,3,http://purl.obolibrary.org/obo/HP_0002817,Abnormality of the upper limb,3
Q7189,Other reduction defects of upper limb,http://purl.obolibrary.org/obo/HP_0100554,Hemihypertrophy of upper limb,3,http://purl.obolibrary.org/obo/HP_0006986,Spasticity of upper limb,3
Q71891,Other reduction defects of right upper limb,http://purl.obolibrary.org/obo/HP_0002817,Abnormality of the upper limb,4,http://purl.obolibrary.org/obo/HP_0002817,Abnormality of the upper limb,4
Q71892,Other reduction defects of left upper limb,http://purl.obolibrary.org/obo/HP_0002817,Abnormality of the upper limb,4,http://purl.obolibrary.org/obo/HP_0002817,Abnormality of the upper limb,4
Q71893,"Other reduction defects of upper limb, bilateral",http://purl.obolibrary.org/obo/MONDO_0017479,"amelia of upper limb, bilateral",3,http://purl.obolibrary.org/obo/HP_0000177,Abnormality of upper lip,5
Q71899,Other reduction defects of unspecified upper limb,http://purl.obolibrary.org/obo/HP_0002817,Abnormality of the upper limb,4,http://purl.obolibrary.org/obo/HP_0002817,Abnormality of the upper limb,4
Q719,Unspecified reduction defect of upper limb,http://purl.obolibrary.org/obo/HP_0100554,Hemihypertrophy of upper limb,3,http://purl.obolibrary.org/obo/HP_0006986,Spasticity of upper limb,3
Q7190,Unspecified reduction defect of unspecified upper limb,http://purl.obolibrary.org/obo/HP_0002817,Abnormality of the upper limb,4,http://purl.obolibrary.org/obo/HP_0000636,Full thickness defect of the upper eyelid,4
Q7191,Unspecified reduction defect of right upper limb,http://purl.obolibrary.org/obo/HP_0002817,Abnormality of the upper limb,4,http://purl.obolibrary.org/obo/HP_0000636,Full thickness defect of the upper eyelid,4
Q7192,Unspecified reduction defect of left upper limb,http://purl.obolibrary.org/obo/HP_0002817,Abnormality of the upper limb,4,http://purl.obolibrary.org/obo/HP_0000636,Full thickness defect of the upper eyelid,4
Q7193,"Unspecified reduction defect of upper limb, bilateral",http://purl.obolibrary.org/obo/MONDO_0017479,"amelia of upper limb, bilateral",3,http://purl.obolibrary.org/obo/HP_0000177,Abnormality of upper lip,5
Q72,Reduction defects of lower limb,http://purl.obolibrary.org/obo/HP_0100553,Hemihypertrophy of lower limb,2,http://purl.obolibrary.org/obo/HP_0002061,Spasticity of lower limb,2
Q720,Congenital complete absence of lower limb,http://purl.obolibrary.org/obo/HP_0012421,Congenital absence of foreskin,3,http://purl.obolibrary.org/obo/HP_0001057,Congenital absence of skin,3
Q7200,Congenital complete absence of unspecified lower limb,http://purl.obolibrary.org/obo/HP_0002814,Abnormality of the lower limb,4,http://purl.obolibrary.org/obo/HP_0001057,Congenital absence of skin,4
Q7201,Congenital complete absence of right lower limb,http://purl.obolibrary.org/obo/HP_0002814,Abnormality of the lower limb,4,http://purl.obolibrary.org/obo/HP_0001057,Congenital absence of skin,4
Q7202,Congenital complete absence of left lower limb,http://purl.obolibrary.org/obo/HP_0002814,Abnormality of the lower limb,4,http://purl.obolibrary.org/obo/HP_0001057,Congenital absence of skin,4
Q7203,"Congenital complete absence of lower limb, bilateral",http://purl.obolibrary.org/obo/MONDO_0017481,"amelia of lower limb, bilateral",3,http://purl.obolibrary.org/obo/HP_0001057,Congenital absence of skin,4
Q721,Congenital absence of thigh and lower leg with foot present,http://purl.obolibrary.org/obo/MONDO_0017442,congenital absence of thigh and lower leg with foot present,1,http://purl.obolibrary.org/obo/HP_0000689,Malalignment of upper and lower dental arches,7
Q7210,Congenital absence of unspecified thigh and lower leg with foot present,http://purl.obolibrary.org/obo/MONDO_0017442,congenital absence of thigh and lower leg with foot present,2,http://purl.obolibrary.org/obo/HP_0000689,Malalignment of upper and lower dental arches,8
Q7211,Congenital absence of right thigh and lower leg with foot present,http://purl.obolibrary.org/obo/MONDO_0017442,congenital absence of thigh and lower leg with foot present,2,http://purl.obolibrary.org/obo/HP_0000324,Asymmetry of right and left side of face,8
Q7212,Congenital absence of left thigh and lower leg with foot present,http://purl.obolibrary.org/obo/MONDO_0017442,congenital absence of thigh and lower leg with foot present,2,http://purl.obolibrary.org/obo/HP_0000689,Malalignment of upper and lower dental arches,8
Q7213,"Congenital absence of thigh and lower leg with foot present, bilateral",http://purl.obolibrary.org/obo/MONDO_0017497,"congenital absence of thigh and lower leg with foot present, bilateral",1,http://purl.obolibrary.org/obo/HP_0000689,Malalignment of upper and lower dental arches,8
Q722,Congenital absence of both lower leg and foot,http://purl.obolibrary.org/obo/MONDO_0017444,congenital absence of both lower leg and foot,1,http://purl.obolibrary.org/obo/HP_0001057,Congenital absence of skin,5
Q7220,"Congenital absence of both lower leg and foot, unspecified lower limb",http://purl.obolibrary.org/obo/MONDO_0017500,"congenital absence of both lower leg and foot, unilateral",4,http://purl.obolibrary.org/obo/HP_0001057,Congenital absence of skin,8
Q7221,"Congenital absence of both lower leg and foot, right lower limb",http://purl.obolibrary.org/obo/MONDO_0017500,"congenital absence of both lower leg and foot, unilateral",4,http://purl.obolibrary.org/obo/HP_0001057,Congenital absence of skin,8
Q7222,"Congenital absence of both lower leg and foot, left lower limb",http://purl.obolibrary.org/obo/MONDO_0017500,"congenital absence of both lower leg and foot, unilateral",4,http://purl.obolibrary.org/obo/HP_0001057,Congenital absence of skin,8
Q7223,"Congenital absence of both lower leg and foot, bilateral",http://purl.obolibrary.org/obo/MONDO_0017501,"congenital absence of both lower leg and foot, bilateral",1,http://purl.obolibrary.org/obo/HP_0001057,Congenital absence of skin,6
Q723,Congenital absence of foot and toe(s),http://purl.obolibrary.org/obo/HP_0012421,Congenital absence of foreskin,3,http://purl.obolibrary.org/obo/HP_0001057,Congenital absence of skin,3
Q7230,Congenital absence of unspecified foot and toe(s),http://purl.obolibrary.org/obo/HP_0012421,Congenital absence of foreskin,4,http://purl.obolibrary.org/obo/HP_0001057,Congenital absence of skin,4
Q7231,Congenital absence of right foot and toe(s),http://purl.obolibrary.org/obo/HP_0012421,Congenital absence of foreskin,4,http://purl.obolibrary.org/obo/HP_0001057,Congenital absence of skin,4
Q7232,Congenital absence of left foot and toe(s),http://purl.obolibrary.org/obo/HP_0012421,Congenital absence of foreskin,4,http://purl.obolibrary.org/obo/HP_0001057,Congenital absence of skin,4
Q7233,"Congenital absence of foot and toe(s), bilateral",http://purl.obolibrary.org/obo/HP_0012421,Congenital absence of foreskin,4,http://purl.obolibrary.org/obo/HP_0001057,Congenital absence of skin,4
Q724,Longitudinal reduction defect of femur,http://purl.obolibrary.org/obo/HP_0010753,Midline defect of mandible,3,http://purl.obolibrary.org/obo/HP_0001809,Longitudinal splitting of nail,3
Q7240,Longitudinal reduction defect of unspecified femur,http://purl.obolibrary.org/obo/HP_0004122,Midline defect of the nose,4,http://purl.obolibrary.org/obo/HP_0000625,Full thickness defect of the eyelid,4
Q7241,Longitudinal reduction defect of right femur,http://purl.obolibrary.org/obo/CL_1000466,chromaffin cell of right ovary,4,http://purl.obolibrary.org/obo/HP_0000625,Full thickness defect of the eyelid,4
Q7242,Longitudinal reduction defect of left femur,http://purl.obolibrary.org/obo/CL_1000467,chromaffin cell of left ovary,4,http://purl.obolibrary.org/obo/HP_0000625,Full thickness defect of the eyelid,4
Q7243,"Longitudinal reduction defect of femur, bilateral",http://purl.obolibrary.org/obo/HP_0004122,Midline defect of the nose,4,http://purl.obolibrary.org/obo/HP_0000625,Full thickness defect of the eyelid,4
Q725,Longitudinal reduction defect of tibia,http://purl.obolibrary.org/obo/HP_0010753,Midline defect of mandible,3,http://purl.obolibrary.org/obo/HP_0001809,Longitudinal splitting of nail,3
Q7250,Longitudinal reduction defect of unspecified tibia,http://purl.obolibrary.org/obo/HP_0004122,Midline defect of the nose,4,http://purl.obolibrary.org/obo/HP_0000625,Full thickness defect of the eyelid,4
Q7251,Longitudinal reduction defect of right tibia,http://purl.obolibrary.org/obo/CL_1000466,chromaffin cell of right ovary,4,http://purl.obolibrary.org/obo/HP_0000625,Full thickness defect of the eyelid,4
Q7252,Longitudinal reduction defect of left tibia,http://purl.obolibrary.org/obo/CL_1000467,chromaffin cell of left ovary,4,http://purl.obolibrary.org/obo/HP_0000625,Full thickness defect of the eyelid,4
Q7253,"Longitudinal reduction defect of tibia, bilateral",http://purl.obolibrary.org/obo/HP_0004122,Midline defect of the nose,4,http://purl.obolibrary.org/obo/HP_0000625,Full thickness defect of the eyelid,4
Q726,Longitudinal reduction defect of fibula,http://purl.obolibrary.org/obo/HP_0010753,Midline defect of mandible,3,http://purl.obolibrary.org/obo/HP_0001809,Longitudinal splitting of nail,3
Q7260,Longitudinal reduction defect of unspecified fibula,http://purl.obolibrary.org/obo/HP_0004122,Midline defect of the nose,4,http://purl.obolibrary.org/obo/HP_0000625,Full thickness defect of the eyelid,4
Q7261,Longitudinal reduction defect of right fibula,http://purl.obolibrary.org/obo/CL_1000466,chromaffin cell of right ovary,4,http://purl.obolibrary.org/obo/HP_0000625,Full thickness defect of the eyelid,4
Q7262,Longitudinal reduction defect of left fibula,http://purl.obolibrary.org/obo/CL_1000467,chromaffin cell of left ovary,4,http://purl.obolibrary.org/obo/HP_0000625,Full thickness defect of the eyelid,4
Q7263,"Longitudinal reduction defect of fibula, bilateral",http://purl.obolibrary.org/obo/HP_0004122,Midline defect of the nose,4,http://purl.obolibrary.org/obo/HP_0000625,Full thickness defect of the eyelid,4
Q727,Split foot,http://purl.obolibrary.org/obo/HP_0001769,Broad foot,1,http://purl.obolibrary.org/obo/HP_0001839,Split foot,0
Q7270,"Split foot, unspecified lower limb",http://purl.obolibrary.org/obo/HP_0002814,Abnormality of the lower limb,3,http://purl.obolibrary.org/obo/HP_0001258,"Spastic paraplegia, lower limb",3
Q7271,"Split foot, right lower limb",http://purl.obolibrary.org/obo/HP_0002814,Abnormality of the lower limb,3,http://purl.obolibrary.org/obo/HP_0001258,"Spastic paraplegia, lower limb",3
Q7272,"Split foot, left lower limb",http://purl.obolibrary.org/obo/HP_0002814,Abnormality of the lower limb,3,http://purl.obolibrary.org/obo/HP_0001258,"Spastic paraplegia, lower limb",3
Q7273,"Split foot, bilateral",http://purl.obolibrary.org/obo/MONDO_0017514,"split foot, bilateral",1,http://purl.obolibrary.org/obo/HP_0000193,Split uvula,2
Q728,Other reduction defects of lower limb,http://purl.obolibrary.org/obo/HP_0100553,Hemihypertrophy of lower limb,3,http://purl.obolibrary.org/obo/HP_0002061,Spasticity of lower limb,3
Q7281,Congenital shortening of lower limb,http://purl.obolibrary.org/obo/HP_0100553,Hemihypertrophy of lower limb,2,http://purl.obolibrary.org/obo/HP_0002061,Spasticity of lower limb,2
Q72811,Congenital shortening of right lower limb,http://purl.obolibrary.org/obo/HP_0002814,Abnormality of the lower limb,3,http://purl.obolibrary.org/obo/HP_0002061,Spasticity of lower limb,3
Q72812,Congenital shortening of left lower limb,http://purl.obolibrary.org/obo/HP_0002814,Abnormality of the lower limb,3,http://purl.obolibrary.org/obo/HP_0002061,Spasticity of lower limb,3
Q72813,"Congenital shortening of lower limb, bilateral",http://purl.obolibrary.org/obo/MONDO_0017481,"amelia of lower limb, bilateral",2,http://purl.obolibrary.org/obo/HP_0000178,Abnormality of lower lip,4
Q72819,Congenital shortening of unspecified lower limb,http://purl.obolibrary.org/obo/HP_0002814,Abnormality of the lower limb,3,http://purl.obolibrary.org/obo/HP_0002061,Spasticity of lower limb,3
Q7289,Other reduction defects of lower limb,http://purl.obolibrary.org/obo/HP_0100553,Hemihypertrophy of lower limb,3,http://purl.obolibrary.org/obo/HP_0002061,Spasticity of lower limb,3
Q72891,Other reduction defects of right lower limb,http://purl.obolibrary.org/obo/HP_0002814,Abnormality of the lower limb,4,http://purl.obolibrary.org/obo/HP_0002061,Spasticity of lower limb,4
Q72892,Other reduction defects of left lower limb,http://purl.obolibrary.org/obo/HP_0002814,Abnormality of the lower limb,4,http://purl.obolibrary.org/obo/HP_0002061,Spasticity of lower limb,4
Q72893,"Other reduction defects of lower limb, bilateral",http://purl.obolibrary.org/obo/MONDO_0017481,"amelia of lower limb, bilateral",3,http://purl.obolibrary.org/obo/HP_0000178,Abnormality of lower lip,5
Q72899,Other reduction defects of unspecified lower limb,http://purl.obolibrary.org/obo/HP_0002814,Abnormality of the lower limb,4,http://purl.obolibrary.org/obo/HP_0002061,Spasticity of lower limb,4
Q729,Unspecified reduction defect of lower limb,http://purl.obolibrary.org/obo/HP_0100553,Hemihypertrophy of lower limb,3,http://purl.obolibrary.org/obo/HP_0002061,Spasticity of lower limb,3
Q7290,Unspecified reduction defect of unspecified lower limb,http://purl.obolibrary.org/obo/HP_0002814,Abnormality of the lower limb,4,http://purl.obolibrary.org/obo/HP_0000652,Full thickness defect of the lower eyelid,4
Q7291,Unspecified reduction defect of right lower limb,http://purl.obolibrary.org/obo/HP_0002814,Abnormality of the lower limb,4,http://purl.obolibrary.org/obo/HP_0000652,Full thickness defect of the lower eyelid,4
Q7292,Unspecified reduction defect of left lower limb,http://purl.obolibrary.org/obo/HP_0002814,Abnormality of the lower limb,4,http://purl.obolibrary.org/obo/HP_0000652,Full thickness defect of the lower eyelid,4
Q7293,"Unspecified reduction defect of lower limb, bilateral",http://purl.obolibrary.org/obo/MONDO_0017481,"amelia of lower limb, bilateral",3,http://purl.obolibrary.org/obo/HP_0000178,Abnormality of lower lip,5
Q73,Reduction defects of unspecified limb,http://purl.obolibrary.org/obo/HP_0004043,Lytic defects of ulnar metaphysis,3,http://purl.obolibrary.org/obo/HP_0002061,Spasticity of lower limb,3
Q730,Congenital absence of unspecified limb(s),http://purl.obolibrary.org/obo/HP_0012421,Congenital absence of foreskin,2,http://purl.obolibrary.org/obo/HP_0001057,Congenital absence of skin,2
Q731,"Phocomelia, unspecified limb(s)",http://purl.obolibrary.org/obo/MONDO_0003472,"pediculosis, unspecified",2,http://purl.obolibrary.org/obo/HP_0000001,All,3
Q738,Other reduction defects of unspecified limb(s),http://purl.obolibrary.org/obo/HP_0004043,Lytic defects of ulnar metaphysis,4,http://purl.obolibrary.org/obo/HP_0002797,Osteolytic defects of bones,4
Q74,Other congenital malformations of limb(s),http://purl.obolibrary.org/obo/MONDO_0000839,congenital anomalies of fetus,3,http://purl.obolibrary.org/obo/HP_0000005,Mode of inheritance,4
Q740,"Other congenital malformations of upper limb(s), including shoulder girdle",http://purl.obolibrary.org/obo/CL_0002631,epithelial cell of upper respiratory tract,7,http://purl.obolibrary.org/obo/HP_0000177,Abnormality of upper lip,7
Q741,Congenital malformation of knee,http://purl.obolibrary.org/obo/HP_0012421,Congenital absence of foreskin,2,http://purl.obolibrary.org/obo/HP_0001057,Congenital absence of skin,2
Q742,"Other congenital malformations of lower limb(s), including pelvic girdle",http://purl.obolibrary.org/obo/UBERON_0001497,muscle of pelvic girdle,6,http://purl.obolibrary.org/obo/HP_0000946,Small wings of the pelvic girdle,6
Q743,Arthrogryposis multiplex congenita,http://purl.obolibrary.org/obo/MONDO_0007157,arthrogryposis multiplex congenita,1,http://purl.obolibrary.org/obo/HP_0002804,Arthrogryposis multiplex congenita,0
Q748,Other specified congenital malformations of limb(s),http://purl.obolibrary.org/obo/MONDO_0000839,congenital anomalies of fetus,4,http://purl.obolibrary.org/obo/HP_0000005,Mode of inheritance,5
Q749,Unspecified congenital malformation of limb(s),http://purl.obolibrary.org/obo/MONDO_0016231,congenital malformation of capillary,2,http://purl.obolibrary.org/obo/HP_0000005,Mode of inheritance,4
Q75,Other congenital malformations of skull and face bones,http://purl.obolibrary.org/obo/MONDO_0007145,congenital defect of skull and scalp,4,http://purl.obolibrary.org/obo/HP_0004437,Enlargement of skull bones,5
Q750,Craniosynostosis,http://identifiers.org/hgnc/10001,RGS5,1,http://purl.obolibrary.org/obo/HP_0001363,Craniosynostosis,0
Q751,Craniofacial dysostosis,http://purl.obolibrary.org/obo/HP_0004484,Craniofacial asymmetry,1,http://purl.obolibrary.org/obo/HP_0004439,Craniofacial dysostosis,0
Q752,Hypertelorism,http://purl.obolibrary.org/obo/HP_0000316,Hypertelorism,0,http://purl.obolibrary.org/obo/HP_0000316,Hypertelorism,0
Q753,Macrocephaly,http://purl.obolibrary.org/obo/HP_0000256,Macrocephaly,0,http://purl.obolibrary.org/obo/HP_0000256,Macrocephaly,0
Q754,Mandibulofacial dysostosis,http://purl.obolibrary.org/obo/MONDO_0000359,spondylocostal dysostosis,1,http://purl.obolibrary.org/obo/HP_0005321,Mandibulofacial dysostosis,0
Q755,Oculomandibular dysostosis,http://purl.obolibrary.org/obo/MONDO_0000359,spondylocostal dysostosis,1,http://purl.obolibrary.org/obo/HP_0004439,Craniofacial dysostosis,1
Q758,Other specified congenital malformations of skull and face bones,http://purl.obolibrary.org/obo/MONDO_0007145,congenital defect of skull and scalp,5,http://purl.obolibrary.org/obo/HP_0004437,Enlargement of skull bones,6
Q759,"Congenital malformation of skull and face bones, unspecified",http://purl.obolibrary.org/obo/HP_0011603,Congenital malformation of the great arteries,5,http://purl.obolibrary.org/obo/HP_0011603,Congenital malformation of the great arteries,5
Q76,Congenital malformations of spine and bony thorax,http://purl.obolibrary.org/obo/MONDO_0020724,cavernous malformations of CNS and retina,4,http://purl.obolibrary.org/obo/HP_0000175,Cleft of hard and soft palate,5
Q760,Spina bifida occulta,http://purl.obolibrary.org/obo/HP_0002414,Spina bifida,1,http://purl.obolibrary.org/obo/HP_0003298,Spina bifida occulta,0
Q761,Klippel-Feil syndrome,http://purl.obolibrary.org/obo/MONDO_0001029,Klippel-Feil syndrome,0,http://purl.obolibrary.org/obo/HP_0004602,Klippel-Feil syndrome,0
Q762,Congenital spondylolisthesis,http://purl.obolibrary.org/obo/HP_0003577,Congenital onset,1,http://purl.obolibrary.org/obo/HP_0000519,Congenital cataract,1
Q763,Congenital scoliosis due to congenital bony malformation,http://purl.obolibrary.org/obo/MONDO_0013143,hereditary thrombophilia due to congenital HRG deficiency,4,http://purl.obolibrary.org/obo/HP_0000061,Ambiguous genitalia due to virilization,5
Q764,"Other congenital malformations of spine, not associated with scoliosis",http://purl.obolibrary.org/obo/MONDO_0016319,congenital absence of pain with hyperhidrosis,6,http://purl.obolibrary.org/obo/HP_0001675,obsolete Rhythm disturbances associated with pheochromocytoma,7
Q7641,Congenital kyphosis,http://purl.obolibrary.org/obo/HP_0003577,Congenital onset,1,http://purl.obolibrary.org/obo/HP_0000519,Congenital cataract,1
Q76411,"Congenital kyphosis, occipito-atlanto-axial region",http://purl.obolibrary.org/obo/BFO_0000006,spatial region,3,http://purl.obolibrary.org/obo/HP_0000272,Depressed malar region,3
Q76412,"Congenital kyphosis, cervical region",http://purl.obolibrary.org/obo/UBERON_0005434,cervical region,2,http://purl.obolibrary.org/obo/HP_0004535,Congenital cervical hypertrichosis,2
Q76413,"Congenital kyphosis, cervicothoracic region",http://purl.obolibrary.org/obo/BFO_0000006,spatial region,3,http://purl.obolibrary.org/obo/HP_0000272,Depressed malar region,3
Q76414,"Congenital kyphosis, thoracic region",http://purl.obolibrary.org/obo/BFO_0000006,spatial region,3,http://purl.obolibrary.org/obo/HP_0000272,Depressed malar region,3
Q76415,"Congenital kyphosis, thoracolumbar region",http://purl.obolibrary.org/obo/BFO_0000006,spatial region,3,http://purl.obolibrary.org/obo/HP_0000272,Depressed malar region,3
Q76419,"Congenital kyphosis, unspecified region",http://purl.obolibrary.org/obo/BFO_0000006,spatial region,3,http://purl.obolibrary.org/obo/HP_0000272,Depressed malar region,3
Q7642,Congenital lordosis,http://purl.obolibrary.org/obo/HP_0003577,Congenital onset,1,http://purl.obolibrary.org/obo/HP_0000519,Congenital cataract,1
Q76425,"Congenital lordosis, thoracolumbar region",http://purl.obolibrary.org/obo/BFO_0000006,spatial region,3,http://purl.obolibrary.org/obo/HP_0000272,Depressed malar region,3
Q76426,"Congenital lordosis, lumbar region",http://purl.obolibrary.org/obo/BFO_0000006,spatial region,3,http://purl.obolibrary.org/obo/HP_0000272,Depressed malar region,3
Q76427,"Congenital lordosis, lumbosacral region",http://purl.obolibrary.org/obo/BFO_0000006,spatial region,3,http://purl.obolibrary.org/obo/HP_0000272,Depressed malar region,3
Q76428,"Congenital lordosis, sacral and sacrococcygeal region",http://purl.obolibrary.org/obo/UBERON_0005473,sacral region,4,http://purl.obolibrary.org/obo/HP_0046506,Pain in head and neck region,4
Q76429,"Congenital lordosis, unspecified region",http://purl.obolibrary.org/obo/BFO_0000006,spatial region,3,http://purl.obolibrary.org/obo/HP_0000272,Depressed malar region,3
Q7649,"Other congenital malformations of spine, not associated with scoliosis",http://purl.obolibrary.org/obo/MONDO_0016319,congenital absence of pain with hyperhidrosis,6,http://purl.obolibrary.org/obo/HP_0001675,obsolete Rhythm disturbances associated with pheochromocytoma,7
Q765,Cervical rib,http://purl.obolibrary.org/obo/HP_0004558,Cervical platyspondyly,1,http://purl.obolibrary.org/obo/HP_0000470,Cervical shortening,1
Q766,Other congenital malformations of ribs,http://purl.obolibrary.org/obo/HP_0040059,Calcification of ribs,3,http://purl.obolibrary.org/obo/HP_0000878,11 pairs of ribs,3
Q767,Congenital malformation of sternum,http://purl.obolibrary.org/obo/HP_0012421,Congenital absence of foreskin,2,http://purl.obolibrary.org/obo/HP_0001057,Congenital absence of skin,2
Q768,Other congenital malformations of bony thorax,http://purl.obolibrary.org/obo/HP_0001555,Asymmetry of the thorax,4,http://purl.obolibrary.org/obo/HP_0000765,Abnormality of the thorax,4
Q769,"Congenital malformation of bony thorax, unspecified",http://purl.obolibrary.org/obo/HP_0011603,Congenital malformation of the great arteries,3,http://purl.obolibrary.org/obo/HP_0011603,Congenital malformation of the great arteries,3
Q77,Osteochondrodysplasia with defects of growth of tubular bones and spine,http://purl.obolibrary.org/obo/MONDO_0011206,ventriculomegaly with defects of the radius and kidney,6,http://purl.obolibrary.org/obo/HP_0002797,Osteolytic defects of bones,7
Q770,Achondrogenesis,http://identifiers.org/hgnc/10001,RGS5,1,http://purl.obolibrary.org/obo/HP_0000001,All,1
Q771,Thanatophoric short stature,http://purl.obolibrary.org/obo/HP_0003498,Disproportionate short stature,1,http://purl.obolibrary.org/obo/HP_0003498,Disproportionate short stature,1
Q772,Short rib syndrome,http://purl.obolibrary.org/obo/MONDO_0001858,slipping rib syndrome,1,http://purl.obolibrary.org/obo/HP_0000012,Overactive bladder syndrome,2
Q773,Chondrodysplasia punctata,http://purl.obolibrary.org/obo/MONDO_0007900,leukonychia punctata,1,http://purl.obolibrary.org/obo/HP_0000001,All,2
Q774,Achondroplasia,http://purl.obolibrary.org/obo/MONDO_0007037,Achondroplasia,0,http://purl.obolibrary.org/obo/HP_0000001,All,1
Q775,Diastrophic dysplasia,http://purl.obolibrary.org/obo/HP_0000110,Renal dysplasia,1,http://purl.obolibrary.org/obo/HP_0000110,Renal dysplasia,1
Q776,Chondroectodermal dysplasia,http://purl.obolibrary.org/obo/MONDO_0009162,Chondroectodermal dysplasia,0,http://purl.obolibrary.org/obo/HP_0000110,Renal dysplasia,1
Q777,Spondyloepiphyseal dysplasia,http://purl.obolibrary.org/obo/HP_0000110,Renal dysplasia,1,http://purl.obolibrary.org/obo/HP_0002655,Spondyloepiphyseal dysplasia,0
Q778,Other osteochondrodysplasia with defects of growth of tubular bones and spine,http://purl.obolibrary.org/obo/MONDO_0011206,ventriculomegaly with defects of the radius and kidney,7,http://purl.obolibrary.org/obo/HP_0002797,Osteolytic defects of bones,8
Q779,"Osteochondrodysplasia with defects of growth of tubular bones and spine, unspecified",http://purl.obolibrary.org/obo/MONDO_0007478,"dwarfism, cortical thickening of tubular bones and transient hypocalcemia",7,http://purl.obolibrary.org/obo/HP_0000668,Failure of development of between one and six teeth,8
Q78,Other osteochondrodysplasias,http://purl.obolibrary.org/obo/MONDO_0004993,Other carcinoma,1,http://purl.obolibrary.org/obo/HP_0000001,All,2
Q780,Osteogenesis imperfecta,http://purl.obolibrary.org/obo/HP_0000703,Dentinogenesis imperfecta,1,http://purl.obolibrary.org/obo/HP_0000703,Dentinogenesis imperfecta,1
Q781,Polyostotic fibrous dysplasia,http://purl.obolibrary.org/obo/MONDO_0000845,fibrous dysplasia,1,http://purl.obolibrary.org/obo/HP_0010735,Polyostotic fibrous dysplasia,0
